<xs:schema attributeFormDefault="unqualified" elementFormDefault="qualified" xmlns:xs="http://www.w3.org/2001/XMLSchema">
  <xs:element name="Body">
      <xs:complexType>
      <xs:sequence>
		  <xs:element name="ExecuteResponse">
			<xs:complexType>
			  <xs:sequence>
				<xs:element name="ExecuteResult">
				  <xs:complexType>
					<xs:sequence>
					  <xs:element type="xs:string" name="Result"/>
					  <xs:element type="xs:string" name="MessageCode"/>
					  <xs:element type="xs:string" name="MessageDescription"/>
					  <xs:element type="xs:string" name="BoxNo"/>
					  <xs:element type="xs:string" name="PalletNo"/>
					  <xs:element type="xs:string" name="PackingInstruction1"/>
					  <xs:element type="xs:string" name="PackingInstruction2"/>
					  <xs:element type="xs:string" name="PackingInstruction3"/>
					  <xs:element type="xs:string" name="PackingInstruction4"/>
					  <xs:element type="xs:string" name="PackingInstruction5"/>
					  <xs:element type="xs:string" name="SerialCount"/>
					  <xs:element type="xs:string" name="MaxSerialCount"/>
					  <xs:element type="xs:string" name="BoxCount"/>
					  <xs:element type="xs:string" name="MaxBoxCount"/>
					</xs:sequence>
				  </xs:complexType>
				</xs:element>
			  </xs:sequence>
			</xs:complexType>
		  </xs:element>
        </xs:sequence>
    </xs:complexType>
  </xs:element>
</xs:schema>